{
  "$schema": "../deeting-manifest-schema.json",
  "id": "official.skills.ingestor",
  "name": "Asset Ingestor",
  "version": "1.0.0",
  "author": "Deeting Team",
  "description": "Smart assistant discovery and onboarding from URLs.",
  "entry": {
    "backend": "main.py"
  },
  "restricted": true,
  "allowed_roles": ["admin"],
  "permissions": [
    "network.outbound",
    "tools.call",
    "assistants.write"
  ],
  "runtime": ["local"],
  "execution": {
    "timeout_seconds": 120
  },
  "capabilities": {
    "llm_tools": "llm-tool.yaml"
  }
}
