{
  "$schema": "../deeting-manifest-schema.json",
  "id": "official.skills.skill_creator",
  "name": "Skill Creator",
  "version": "1.0.0",
  "author": "Deeting Team",
  "description": "Create new Deeting skills with the docs-first structure (SKILL.md + deeting.json + main.py, optional llm-tool.yaml) in the user skills directory.",
  "entry": {
    "backend": "main.py"
  },
  "permissions": [
    "fs.read",
    "fs.write"
  ],
  "runtime": ["local"],
  "execution": {
    "timeout_seconds": 60
  },
  "capabilities": {
    "llm_tools": "llm-tool.yaml"
  }
}
