{
  "$schema": "../deeting-manifest-schema.json",
  "id": "official.skills.scheduler",
  "name": "Task Scheduler",
  "version": "1.0.0",
  "author": "Deeting Team",
  "description": "Handle long-running background tasks.",
  "entry": {
    "backend": "main.py"
  },
  "runtime": ["cloud", "local"],
  "execution": {
    "timeout_seconds": 60
  },
  "capabilities": {
    "llm_tools": "llm-tool.yaml"
  }
}
