{
  "id": "com.deeting.example.weather",
  "name": "Live Weather",
  "version": "1.1.0",
  "author": "Deeting Team",
  "description": "Get real-time weather info with beautiful visualization.",
  "entry": {
    "backend": "main.py",
    "ui": "ui/index.html"
  },
  "permissions": [
    "network.outbound"
  ],
  "capabilities": {
    "llm_tools": "llm-tool.yaml"
  }
}
