{
  "$schema": "../deeting-manifest-schema.json",
  "id": "official.skills.crawler",
  "name": "Scout Crawler",
  "version": "1.0.0",
  "author": "Deeting Team",
  "description": "Universal web crawling and content extraction skill.",
  "entry": {
    "backend": "main.py"
  },
  "permissions": [
    "network.outbound"
  ],
  "runtime": ["cloud", "local"],
  "execution": {
    "timeout_seconds": 120
  },
  "env_requirements": [
    "SCOUT_SERVICE_URL"
  ],
  "capabilities": {
    "llm_tools": "llm-tool.yaml"
  }
}
